{
"version": 2,
"execution": {
"mode": "autonomous",
"defaultDryRun": false,
"allowMainnetOnly": true,
"requireSimulation": true,
"humanConfirmation": false,
"requireRecipientAllowlist": true,
"requireKeySegregation": true
},
"allowlists": {
"chains": ["base", "solana", "hyperliquid"],
"assets": ["ETH", "USDC", "SOL", "HYPE"],
"recipients": [
"HSGfLrCiMpnGW8o7qhad79JU6aZH1TW37tpsqdRhuUPx",
"0x3dd3b88Ee622415DD85a73E5274d29d52BF2a4c6",
"0x1113b4e00397997ebdaac95ceb90cf97bd4d51dd"
],
"contracts": [],
"bridgeRoutes": [
{ "from": "base", "to": "solana" },
{ "from": "solana", "to": "base" }
],
"hyperliquidSymbols": []
},
"limits": {
"maxNotionalUsdPerTx": null,
"maxNotionalUsdPerDay": null,
"maxSlippageBps": null,
"maxGasUsdPerTx": null,
"maxPerpLeverage": null,
"maxOrderSize": null,
"defaultSlippageBps": null
},
"marketData": {
"primaryPriceSource": "chainlink",
"fallbackPriceSource": "pyth"
},
"routing": {
"bridgeProviders": ["debridge"],
"bridgeSourceChains": ["base", "solana"],
"hyperliquidOperationalRole": "destination_l3"
},
"reporting": {
"discordChannelId": "1473392629055098942",
"perOperation": true,
"dailySummary": {
"enabled": true,
"timeUtc": "23:00"
}
},
"circuitBreaker": {
"enabled": true,
"maxFailures": 3,
"windowSec": 300,
"cooldownSec": 900
},
"idempotency": {
"ttlDays": 7
}
}
